{"day_utc":"2026-03-07","input_manifest":[{"day_utc":"2026-03-07","path":"/home/node/constellation_2_runtime/constellation_2/runtime/truth/execution_evidence_v1/submissions/2026-03-07","producer":"execution_evidence_v1","sha256":"0000000000000000000000000000000000000000000000000000000000000000","type":"execution_evidence"}],"positions":{"asof_utc":"2026-03-07T00:00:00Z","currency":"USD","items":[{"avg_cost_cents":123,"engine_id":"unknown","instrument":{"kind":"OPTION_MULTI","legs":[{"action":"SELL","expiry_utc":"2026-03-20T00:00:00Z","ib_conId":111111111,"ib_localSymbol":"SPY  260320P00495000","ratio":1,"right":"P","strike":"495.00"},{"action":"BUY","expiry_utc":"2026-03-20T00:00:00Z","ib_conId":222222222,"ib_localSymbol":"SPY  260320P00490000","ratio":1,"right":"P","strike":"490.00"}],"summary":{"expiry_utc":null,"right":null,"strike":null},"underlying":"SPY"},"market_exposure_type":"UNDEFINED_RISK","max_loss_cents":null,"opened_day_utc":"2026-03-07","position_id":"ead8fbb1affd1185aff1cb98cd1d777f3ce4ce1024bb3f3aac431000bcecfcdc","qty":1,"status":"OPEN"}],"notes":["instrument identity derived deterministically from mirrored order_plan.v1.json; multi-leg supported"]},"produced_utc":"2026-03-07T00:00:00Z","producer":{"git_sha":"83006df","module":"constellation_2/phaseF/positions/run/run_positions_snapshot_day_v3.py","repo":"constellation_2_runtime"},"reason_codes":["INSTRUMENT_IDENTITY_FROM_ORDER_PLAN_V3"],"schema_id":"C2_POSITIONS_SNAPSHOT_V3","schema_version":3,"status":"OK"}
